{
  "schema": "fukuro.telemetry-event/v1",
  "source": "ouro",
  "sourceEventId": "EVT-000004",
  "occurredAt": "2026-07-14T00:00:00.000Z",
  "kind": "tick",
  "subject": {
    "system": "ouro",
    "type": "run",
    "id": "RUN-0001",
    "version": "1"
  },
  "refs": [
    {
      "system": "github",
      "type": "file",
      "id": "semigrp/example:procedures/run.mjs",
      "version": "0123456789abcdef",
      "digest": "sha256:1111111111111111111111111111111111111111111111111111111111111111"
    }
  ],
  "data": {
    "attempt": 1,
    "durationMs": 240,
    "exitCode": 0,
    "status": "succeeded"
  }
}
